{"active_ledger_schema_version":1,"active_ledger_source":"repository-active-handoff-ledger","approved_cutoff":"abce8ffe37d25cc8f189ae9e9a2a1e942279a5ad","artifact_status":"not-produced","branch":"codex/dev-review-report","bundle_content_sha256":"6e546677d55b74be0f52367695c4f709055a48c604b5073abb36a1e3f569fe7a","catalog_sha256":"d5ea863e68ba6af1cefabaa438422a7b581c6ab7930f7e3c2f027c4cd9407a6c","collector_pyz_sha256":"e11da8de8147fbbaab5217f56dde7eea7636cacf8993230c85484b1ef6358301","collector_source_commit":"0b28548e5ebe1ee6f5c174122d56c92c2e6005ed","collector_source_sha256":"166a0b445aa4761a3b7ad4f0c9ed6c4656be94ca71e1696b42becb20c573a69e","compile_status":"not-run","evidence_commit":"0b28548e5ebe1ee6f5c174122d56c92c2e6005ed","evidence_tree":"cbcac84169c75133fdb2de1b984ef62645edd5b7","generation_record_id":"record-bundle-generation","handoff_created_at":"2026-07-18T13:38:11Z","handoff_expires_at":"2026-07-25T12:38:11Z","handoff_id":"handoff-80d8cb2c06104fcf3c74","handoff_sha256":"0964ef2f00d2d370f7583616b45df7ea6a78b6ebc1556110caa3547fbb5b6681","issuance_revocation_snapshot_sha256":"1e992f6b67cc41d8bbb8f0d196febab781896a8378fb84bd514ba74ee199dff4","kit_id":"kit-d5ea863e68ba6af1cefa","kit_sidecar_sha256":"c72da27158d0dcbf9399673781bedfff75a1fc0bcf3c383b00be08a12ad256ba","kit_zip_sha256":"db46b7c1e09741b71097554e9383356b90a1d77ef90fc3d910f1387344ade977","manifest_digest":"d8fe08827f1babf7282e6177e6d2e9d8c9c6cdc1f201e86812e37504986f0522","manifest_sha256":"5bbfb3fa44e11ae36fb21175b2076d0e022c26837da3f683b716e2bba30705e9","python_requirement":"CPython 3.12","release_eligible":false,"repository":"doylenehemiah6893-afk/Macro_menu","review_record_id":"record-bundle-independent-review","schema_version":1,"schemas_sha256":"2fec22d89a31c717df1f8e5e4ab6c62eb7e5333d3b0ea675d086e4a406ae6464","session_skeleton_members":[{"path":"artifact-manifest.json","sha256":"f60c0158790007972a8566f37da3eb3fd843dafc55742bdfb5071c13ddad5466","size":213},{"path":"compile-result.json","sha256":"b449ecf173bf7516be714be1d1259f3c4d497200a43c3b31279c156791b6b5f0","size":1196},{"path":"test-results.json","sha256":"1d0a974062dccd3fe367776021a1884714f99d9ac85264655a885736ea69ad27","size":5433}],"session_skeleton_sha256":"6facb6d77bdfb11aa5e5aa4b9db2563bf59fdfea405fb5f3b976acdc42b21311","target_case_status":"not-run","templates_sha256":"622102490944582cafa4e2bd9aa5da8222cd4ba99eece13f9a251b9c00607697","test_record_id":"record-target-collector-tests","tutorials_sha256":"0b1a53ac8150513b9e91204ed745c0cbdc207ed5cf60ca5a6f4ed777e42aabe0"}
