{"active_ledger_schema_version":1,"active_ledger_source":"repository-active-handoff-ledger","approved_cutoff":"abce8ffe37d25cc8f189ae9e9a2a1e942279a5ad","artifact_status":"not-produced","branch":"codex/dev-review-report","bundle_content_sha256":"ba089f0859bdcac85185423f861b0c57f3d08e544b694ec26cc836dfb737e00b","catalog_sha256":"87ecc7bcf3d8f9deaf9916f0ae16e0c192db8044c32ffc569ce2385ad9247a21","collector_pyz_sha256":"e11da8de8147fbbaab5217f56dde7eea7636cacf8993230c85484b1ef6358301","collector_source_commit":"43274914149a67c3f076e5322e86060e3b1d1cc1","collector_source_sha256":"166a0b445aa4761a3b7ad4f0c9ed6c4656be94ca71e1696b42becb20c573a69e","compile_status":"not-run","evidence_commit":"43274914149a67c3f076e5322e86060e3b1d1cc1","evidence_tree":"190494ac751fff8b51b925413f46b426f4e5eb25","generation_record_id":"record-bundle-generation","handoff_created_at":"2026-07-16T15:52:15Z","handoff_expires_at":"2026-07-23T15:51:52Z","handoff_id":"handoff-07bbe55bc7552489cd55","handoff_sha256":"f301e8b4a89de22add30a6ebc7092de5013824dd81c81c2ffa582dd71639d3fa","issuance_revocation_snapshot_sha256":"65670c6ba2759c4504b80ef8cb807cf4551e44db32d0ab342aedde279e9295ee","kit_id":"kit-87ecc7bcf3d8f9deaf99","kit_sidecar_sha256":"4aec1bc19d4e61b6d26b91fc97b0a9c8ff7581901bf965faeb404eaca5efcd8b","kit_zip_sha256":"165d044494a583cebf292e3e3df0f438cb4c3918d2d7ee7bb87055893d719af1","manifest_digest":"d8fe08827f1babf7282e6177e6d2e9d8c9c6cdc1f201e86812e37504986f0522","manifest_sha256":"4073b06d6fcf9d2787ff30b8b82e65f741df3bdb1f8a471d3b5123efb4019009","python_requirement":"CPython 3.12","release_eligible":false,"repository":"doylenehemiah6893-afk/Macro_menu","review_record_id":"record-bundle-independent-review","schema_version":1,"schemas_sha256":"2fec22d89a31c717df1f8e5e4ab6c62eb7e5333d3b0ea675d086e4a406ae6464","session_skeleton_members":[{"path":"artifact-manifest.json","sha256":"f60c0158790007972a8566f37da3eb3fd843dafc55742bdfb5071c13ddad5466","size":213},{"path":"compile-result.json","sha256":"b449ecf173bf7516be714be1d1259f3c4d497200a43c3b31279c156791b6b5f0","size":1196},{"path":"test-results.json","sha256":"1d0a974062dccd3fe367776021a1884714f99d9ac85264655a885736ea69ad27","size":5433}],"session_skeleton_sha256":"6facb6d77bdfb11aa5e5aa4b9db2563bf59fdfea405fb5f3b976acdc42b21311","target_case_status":"not-run","templates_sha256":"622102490944582cafa4e2bd9aa5da8222cd4ba99eece13f9a251b9c00607697","test_record_id":"record-target-collector-tests","tutorials_sha256":"0b1a53ac8150513b9e91204ed745c0cbdc207ed5cf60ca5a6f4ed777e42aabe0"}
