{"active_ledger_schema_version":1,"active_ledger_source":"repository-active-handoff-ledger","approved_cutoff":"abce8ffe37d25cc8f189ae9e9a2a1e942279a5ad","artifact_status":"not-produced","branch":"codex/dev-review-report","bundle_content_sha256":"b144330c4517407927152295c7510a283c953f09c3df0b9d566c14cde51bf092","catalog_sha256":"a235b5dd5fc27d09b7de5d00b811fdf105a37958801ccdbd0ac228e825e55763","collector_pyz_sha256":"e11da8de8147fbbaab5217f56dde7eea7636cacf8993230c85484b1ef6358301","collector_source_commit":"982ce2bd11ad971b9614e12d38a6830b5a7789ba","collector_source_sha256":"166a0b445aa4761a3b7ad4f0c9ed6c4656be94ca71e1696b42becb20c573a69e","compile_status":"not-run","evidence_commit":"982ce2bd11ad971b9614e12d38a6830b5a7789ba","evidence_tree":"b4e423ac2faccbcc0c11e65e8a10917ece862c88","generation_record_id":"record-bundle-generation","handoff_created_at":"2026-07-18T15:33:27Z","handoff_expires_at":"2026-07-25T14:33:26Z","handoff_id":"handoff-be908ee37a9b5beba0b5","handoff_sha256":"d7b87d0ee40ac3dc8c4ead0425014723b926fcbeb52923e37e91d54ea0c5c4d9","issuance_revocation_snapshot_sha256":"4f33ce6b2e07a91929563f9bb5bec6816d2a8a10782fe704284dadeb27567c7b","kit_id":"kit-a235b5dd5fc27d09b7de","kit_sidecar_sha256":"5575207cef866ffaac6ca7202d4a69ea020c7fd9a7b7d9995a3971a00888b494","kit_zip_sha256":"cee08464bf22024f733b2277e61defdf448e76f41b18082225ffb880fec7fe45","manifest_digest":"d8fe08827f1babf7282e6177e6d2e9d8c9c6cdc1f201e86812e37504986f0522","manifest_sha256":"f666b8a2a41e9cb0cb421f22b5fbc4e10c45b879ab5deed88418e987bb448ad9","python_requirement":"CPython 3.12","release_eligible":false,"repository":"doylenehemiah6893-afk/Macro_menu","review_record_id":"record-bundle-independent-review","schema_version":1,"schemas_sha256":"2fec22d89a31c717df1f8e5e4ab6c62eb7e5333d3b0ea675d086e4a406ae6464","session_skeleton_members":[{"path":"artifact-manifest.json","sha256":"f60c0158790007972a8566f37da3eb3fd843dafc55742bdfb5071c13ddad5466","size":213},{"path":"compile-result.json","sha256":"b449ecf173bf7516be714be1d1259f3c4d497200a43c3b31279c156791b6b5f0","size":1196},{"path":"test-results.json","sha256":"1d0a974062dccd3fe367776021a1884714f99d9ac85264655a885736ea69ad27","size":5433}],"session_skeleton_sha256":"6facb6d77bdfb11aa5e5aa4b9db2563bf59fdfea405fb5f3b976acdc42b21311","target_case_status":"not-run","templates_sha256":"622102490944582cafa4e2bd9aa5da8222cd4ba99eece13f9a251b9c00607697","test_record_id":"record-target-collector-tests","tutorials_sha256":"0b1a53ac8150513b9e91204ed745c0cbdc207ed5cf60ca5a6f4ed777e42aabe0"}
