{"active_ledger_schema_version":1,"active_ledger_source":"repository-active-handoff-ledger","approved_cutoff":"abce8ffe37d25cc8f189ae9e9a2a1e942279a5ad","artifact_status":"not-produced","branch":"codex/dev-review-report","bundle_content_sha256":"c0769c5fe635584e178cc3c249d4be4405c0504551273cc40e3773020d5b5de8","catalog_sha256":"1ce7c253b8220c5aa53bad37f9565a21ddc013d966b878b5e4f04571ccc5f497","collector_pyz_sha256":"e11da8de8147fbbaab5217f56dde7eea7636cacf8993230c85484b1ef6358301","collector_source_commit":"957d0f23c40513a9b82d583e8428d7c85d1710c5","collector_source_sha256":"166a0b445aa4761a3b7ad4f0c9ed6c4656be94ca71e1696b42becb20c573a69e","compile_status":"not-run","evidence_commit":"957d0f23c40513a9b82d583e8428d7c85d1710c5","evidence_tree":"fe3d79dedfeb282e5e80f8ebf0a345b927811b35","generation_record_id":"record-bundle-generation-957d0f2","handoff_created_at":"2026-07-18T20:01:32Z","handoff_expires_at":"2026-07-25T19:00:38Z","handoff_id":"handoff-abb194d469d790637ab1","handoff_sha256":"31cb3a4c5659715601f03e8484e1731337523ae53e7b6a62514c00c874c484f9","issuance_revocation_snapshot_sha256":"735d333e2f492f07776bd6f78bc5e75858a28fc712065aa01737fbef300e1834","kit_id":"kit-1ce7c253b8220c5aa53b","kit_sidecar_sha256":"ec4255eb2b47095bb3c6b36925b8b8d7190ab430c1a1c4577b48cf3095349141","kit_zip_sha256":"8f5b213c7194092d425959c42d4254df941cccbc4b0708568c935b542adf8544","manifest_digest":"d8fe08827f1babf7282e6177e6d2e9d8c9c6cdc1f201e86812e37504986f0522","manifest_sha256":"879712ca6ccba2a118c79e23b07a00ae6a28e711298d582bc49db190ec736a6a","python_requirement":"CPython 3.12","release_eligible":false,"repository":"doylenehemiah6893-afk/Macro_menu","review_record_id":"record-bundle-review-957d0f2","schema_version":1,"schemas_sha256":"2fec22d89a31c717df1f8e5e4ab6c62eb7e5333d3b0ea675d086e4a406ae6464","session_skeleton_members":[{"path":"artifact-manifest.json","sha256":"f60c0158790007972a8566f37da3eb3fd843dafc55742bdfb5071c13ddad5466","size":213},{"path":"compile-result.json","sha256":"b449ecf173bf7516be714be1d1259f3c4d497200a43c3b31279c156791b6b5f0","size":1196},{"path":"test-results.json","sha256":"1d0a974062dccd3fe367776021a1884714f99d9ac85264655a885736ea69ad27","size":5433}],"session_skeleton_sha256":"6facb6d77bdfb11aa5e5aa4b9db2563bf59fdfea405fb5f3b976acdc42b21311","target_case_status":"not-run","templates_sha256":"622102490944582cafa4e2bd9aa5da8222cd4ba99eece13f9a251b9c00607697","test_record_id":"record-target-collector-tests-957d0f2","tutorials_sha256":"0b1a53ac8150513b9e91204ed745c0cbdc207ed5cf60ca5a6f4ed777e42aabe0"}
