{"active_ledger_schema_version":1,"active_ledger_source":"repository-active-handoff-ledger","approved_cutoff":"abce8ffe37d25cc8f189ae9e9a2a1e942279a5ad","artifact_status":"not-produced","branch":"codex/dev-review-report","bundle_content_sha256":"0b9c0d4bd45513657304632a4b091a1ea502931954c30262039a4dfdd264b93f","catalog_sha256":"a09bfd3dcb7264c8bc0e35c32fc00b7bf95caa502aafb4d464e50efaa63b2a57","collector_pyz_sha256":"e11da8de8147fbbaab5217f56dde7eea7636cacf8993230c85484b1ef6358301","collector_source_commit":"f2c9d8d8cd1e448444dd43aadb5e4fa57b5c86d0","collector_source_sha256":"166a0b445aa4761a3b7ad4f0c9ed6c4656be94ca71e1696b42becb20c573a69e","compile_status":"not-run","evidence_commit":"f2c9d8d8cd1e448444dd43aadb5e4fa57b5c86d0","evidence_tree":"6d9e36b85b5f8d1294c9934dff625497bc2441c9","generation_record_id":"record.a-env-generation.f2c9d8d","handoff_created_at":"2026-07-16T15:20:31Z","handoff_expires_at":"2026-07-23T15:19:09Z","handoff_id":"handoff-56097be57a37a63c7644","handoff_sha256":"ad6ca230bab403077f0fba8ea6ae11157b555d6605613fb862fe9c0818c4a141","issuance_revocation_snapshot_sha256":"80523b67ad19794293dd8b860e028f4dc62e4396e7796b91df300921a142cca0","kit_id":"kit-a09bfd3dcb7264c8bc0e","kit_sidecar_sha256":"57463baceb0c64dedc0970ed1c57ab0d21789527ccc4aa3ac9567ad79bbc2cab","kit_zip_sha256":"87a0e4f283ee46d220a2e4d297f6de62a31c70a845af48ededacdab3723f8333","manifest_digest":"d8fe08827f1babf7282e6177e6d2e9d8c9c6cdc1f201e86812e37504986f0522","manifest_sha256":"6d40a1f92f09aefde8e7397582ddf8092b876a2f71eebbb8131920aea76820f5","python_requirement":"CPython 3.12","release_eligible":false,"repository":"doylenehemiah6893-afk/Macro_menu","review_record_id":"record.a-env-bundle-review.f2c9d8d","schema_version":1,"schemas_sha256":"2fec22d89a31c717df1f8e5e4ab6c62eb7e5333d3b0ea675d086e4a406ae6464","session_skeleton_members":[{"path":"artifact-manifest.json","sha256":"f60c0158790007972a8566f37da3eb3fd843dafc55742bdfb5071c13ddad5466","size":213},{"path":"compile-result.json","sha256":"b449ecf173bf7516be714be1d1259f3c4d497200a43c3b31279c156791b6b5f0","size":1196},{"path":"test-results.json","sha256":"1d0a974062dccd3fe367776021a1884714f99d9ac85264655a885736ea69ad27","size":5433}],"session_skeleton_sha256":"6facb6d77bdfb11aa5e5aa4b9db2563bf59fdfea405fb5f3b976acdc42b21311","target_case_status":"not-run","templates_sha256":"622102490944582cafa4e2bd9aa5da8222cd4ba99eece13f9a251b9c00607697","test_record_id":"record.a-env-test.1664","tutorials_sha256":"0b1a53ac8150513b9e91204ed745c0cbdc207ed5cf60ca5a6f4ed777e42aabe0"}
