{"active_ledger_schema_version":1,"active_ledger_source":"repository-active-handoff-ledger","approved_cutoff":"abce8ffe37d25cc8f189ae9e9a2a1e942279a5ad","artifact_status":"not-produced","branch":"codex/dev-review-report","bundle_content_sha256":"e0970c54f7f4ea2004afcbd0b7867b13467a590d658b4c527b6cc0a033edf91c","catalog_sha256":"e93a2e7f48c3f4d2f17977e5ecf0b01c1d5ffa241c4569ceeed20be7c1d1d736","collector_pyz_sha256":"e11da8de8147fbbaab5217f56dde7eea7636cacf8993230c85484b1ef6358301","collector_source_commit":"68022541bf8cacd1db012128daf4cdef1048af8d","collector_source_sha256":"166a0b445aa4761a3b7ad4f0c9ed6c4656be94ca71e1696b42becb20c573a69e","compile_status":"not-run","evidence_commit":"68022541bf8cacd1db012128daf4cdef1048af8d","evidence_tree":"405f24751ddabecced9b547680e6dbdefdeb80be","generation_record_id":"record.a-env-generation.6802254","handoff_created_at":"2026-07-16T11:12:06Z","handoff_expires_at":"2026-07-23T11:11:06Z","handoff_id":"handoff-b8d9d535604e78551423","handoff_sha256":"6d889446c62e0de338e6469784166f4d72dd3144618969a2b286748e10e44192","issuance_revocation_snapshot_sha256":"c2fd81b9af2d540218e502b2f6a64b63eaf10b7adc78eb82ce6afc0262017a96","kit_id":"kit-e93a2e7f48c3f4d2f179","kit_sidecar_sha256":"74874056f58c75de184d832325578166fa5ccea5e2b40539dfc0cbf492148039","kit_zip_sha256":"d763b3e1a1a2e33d994a5c030e0fa3b541e8a46648f11378870c6a86711cf012","manifest_digest":"d8fe08827f1babf7282e6177e6d2e9d8c9c6cdc1f201e86812e37504986f0522","manifest_sha256":"9ecb5f9d91317bf2076054433590bcee0b7661a62bf958df37ee6a0b1556508a","python_requirement":"CPython 3.12","release_eligible":false,"repository":"doylenehemiah6893-afk/Macro_menu","review_record_id":"record.a-env-bundle-review.6802254","schema_version":1,"schemas_sha256":"2fec22d89a31c717df1f8e5e4ab6c62eb7e5333d3b0ea675d086e4a406ae6464","session_skeleton_members":[{"path":"artifact-manifest.json","sha256":"f60c0158790007972a8566f37da3eb3fd843dafc55742bdfb5071c13ddad5466","size":213},{"path":"compile-result.json","sha256":"b449ecf173bf7516be714be1d1259f3c4d497200a43c3b31279c156791b6b5f0","size":1196},{"path":"test-results.json","sha256":"1d0a974062dccd3fe367776021a1884714f99d9ac85264655a885736ea69ad27","size":5433}],"session_skeleton_sha256":"6facb6d77bdfb11aa5e5aa4b9db2563bf59fdfea405fb5f3b976acdc42b21311","target_case_status":"not-run","templates_sha256":"622102490944582cafa4e2bd9aa5da8222cd4ba99eece13f9a251b9c00607697","test_record_id":"record.a-env-test.1659","tutorials_sha256":"0b1a53ac8150513b9e91204ed745c0cbdc207ed5cf60ca5a6f4ed777e42aabe0"}
