{"active_ledger_schema_version":1,"active_ledger_source":"repository-active-handoff-ledger","approved_cutoff":"abce8ffe37d25cc8f189ae9e9a2a1e942279a5ad","artifact_status":"not-produced","branch":"codex/dev-review-report","bundle_content_sha256":"2beedfefade73206f2b3e1a9381c3c54cfc73615a39fa5e0e965f50f231d7356","catalog_sha256":"256c8986f4a57bc0942f81c4b27538e370a556b7c6fdb35efa861d3e33df6a4d","collector_pyz_sha256":"e11da8de8147fbbaab5217f56dde7eea7636cacf8993230c85484b1ef6358301","collector_source_commit":"7477c28759fcb6a7188caba8dc5386264b90fe2b","collector_source_sha256":"166a0b445aa4761a3b7ad4f0c9ed6c4656be94ca71e1696b42becb20c573a69e","compile_status":"not-run","evidence_commit":"7477c28759fcb6a7188caba8dc5386264b90fe2b","evidence_tree":"c1642f2bdccee8f7ca2bd3d0bc6b5d06dfb524ae","generation_record_id":"record-bundle-generation","handoff_created_at":"2026-07-18T15:59:00Z","handoff_expires_at":"2026-07-25T14:59:00Z","handoff_id":"handoff-bc6d14adc7f50224591e","handoff_sha256":"8cfc6c442abe985f6f3c7f08e28022603552c6c7cb33c601b262a3c18712875b","issuance_revocation_snapshot_sha256":"d1b33e9d37d0fae8db5ea5bc8b69026e7a6744536b577bbd9bfdc1b4375a4fe7","kit_id":"kit-256c8986f4a57bc0942f","kit_sidecar_sha256":"7cfb3e72720720e7c74994a885c4bcbe3990b5483f0e6bb81f4389a2f424ce08","kit_zip_sha256":"a81d39cc596dff18e84be70f5b910f765a8538d3ed912d8d2c9aeb10cd7e327f","manifest_digest":"d8fe08827f1babf7282e6177e6d2e9d8c9c6cdc1f201e86812e37504986f0522","manifest_sha256":"478fec442cfc1068ff6a106b3bce0e1141d668c49fd8785c28e09d5581bf1eab","python_requirement":"CPython 3.12","release_eligible":false,"repository":"doylenehemiah6893-afk/Macro_menu","review_record_id":"record-bundle-independent-review","schema_version":1,"schemas_sha256":"2fec22d89a31c717df1f8e5e4ab6c62eb7e5333d3b0ea675d086e4a406ae6464","session_skeleton_members":[{"path":"artifact-manifest.json","sha256":"f60c0158790007972a8566f37da3eb3fd843dafc55742bdfb5071c13ddad5466","size":213},{"path":"compile-result.json","sha256":"b449ecf173bf7516be714be1d1259f3c4d497200a43c3b31279c156791b6b5f0","size":1196},{"path":"test-results.json","sha256":"1d0a974062dccd3fe367776021a1884714f99d9ac85264655a885736ea69ad27","size":5433}],"session_skeleton_sha256":"6facb6d77bdfb11aa5e5aa4b9db2563bf59fdfea405fb5f3b976acdc42b21311","target_case_status":"not-run","templates_sha256":"622102490944582cafa4e2bd9aa5da8222cd4ba99eece13f9a251b9c00607697","test_record_id":"record-target-collector-tests","tutorials_sha256":"0b1a53ac8150513b9e91204ed745c0cbdc207ed5cf60ca5a6f4ed777e42aabe0"}
